,title,url,raw_contents,summary,keywords,locate,score
2,서울여행 남산타워,https://blog.naver.com/PostView.nhn?blogId=jety07&logNo=221612921204&from=search&redirect=Log&widgetTypeCall=true&directAccess=false,"



서울여행 오늘의 마지막코스 남산타워 서울N타워라고 부르는거같다 외국인친구 랑 가볼만한곳에서 봤는데정말로 주말은 외국인 손님들 천국☆ 미안하지만 나도 처음이야 ㅠㅠㅠㅠ 올라가는길에 한컷 한7년전에 밑에까지 버스타고 가서 타워는 안올라갔었는데  애초에는 롯데타워쪽을 계획했다가 앞에 구슬모아당구장 전시를 보러 갔기 때문에 동선이 안맞아서 포기 ㅠㅠㅠㅠ 아쉽​한남동에서 명동성당 버스 정류장에서 내린김에 지나감 밝을때 본 명동성당 관광객이 많다 가까이에는 처음 가봄 ㅋㅋㅋ 저멀리 보이는 남산타워  이날 덥고 습하고 구름도 많고 소나기 온다고했다가 안와서 다행인날 


 




 

 







남산서울타워
서울특별시 용산구 용산동2가 산111

 

남산케이블카
서울특별시 중구 회현동1가 산119

 


 




 

 


올라가는길은 그전에 방문한게 명동이여서 버스타자니 뱅뱅돌아가는 길이고 걸어서 케이블카 정류장까지 가다가 급더위와 산을 한 15정도는 탄거 같아 완전 언덕 골목길로 올라가는데 나도모르게 지쳤나보다 ㅋㅋㅋ내려올때는 택시라도 타고와야겠다 생각함   남산케이블카 타고 감 편도랑 왕복 비용이 많이 차이가 안나니 많이 이용하시는데 우리는 내려올때는 버스탈거라서 편도로구매 왕복이 9500원 이구 편도가 7500원으로 기억 드디어 언덕 등반끝 표사러가는길 밤이 조명때문에 좀 더 예쁘다  하지만 여기서는 긴 기다림의 시작이라는것을 몰랐지 입구에서 조명빨 받은 남산타워 초점 이탈 ㅋㅋㅋ 근데 뭐 ㅋㅋ 그냥 시원한 느낌 나니까 ㅋㅋㅋㅋ 도쿄타워 밑에도 길에 이렇게 해놨던거 생각난다 


 





 

 


 


케이블카 내려서 타워올라가는길에 데크가 있어서 일단 아래 한번 봐주고 케이블카는 여수나 홍콩 같은데 있는 4인 케이블카 아니였고 한번에 한 20명씩 왕창 타는 거였다 완전 남는장사네 ㅋㅋㅋㅋ한명에 5천원만 받으세여가기 전주에 사고났었어서 운행 안할줄알았는데 안에 선풍기 그런건 없어서 엄청 더웠고 쉬지않고 손님 태우고있었다 낮에탄다면 그래도 아래에 푸르른 나무잎들도 구경하고 그랬을꺼야 ㅋㅋㅋ 사실 구경할만큼 탑승시간이 길지도 않다  내려올때 버스 타고 내려왔는데 그게 더 운치 있는거 같았다 다음에는 올라가게되면 버스타고 가야지 ㅋㅋㅋㅋ 가파르고 약간 구불구불하지만 버스 기사님 베스트 드라이버 ㅋㅋ ​​타워 데크쪽엔 그유명한 자물쇠들 걸려있는공간이 있구   자물쇠 자판기도 있더라 ㅋㅋㅋ신기방기 ㅋㅋㅋㅋ 의외로 외국인분들도 많이 자물쇠 뽑고 계셔서 의외였다 폰카로 찍어도 날씨가 좋아서 그런지 멋있었다 


 





 

 


 


안에들어가서 타워 위에 올라가는 표를 샀는데 사면서부터 이미 30분정도 대기라고 해서 그래 금방 가겠지 해서 올라가기로 했는데  진짜 밑에서 대기하는사람도 어마어마하다 둘이서 기다리면서 음 그래 여긴 한번이면 족해  그러니까 기다릴 수 있는거야중얼중얼 ㅋㅋㅋㅋㅋ 그리고 누군가 간다고 하면 주말에 가라고 절대 하지말자 ㅋㅋㅋㅋㅋ 아까 케이블카 탄다고 계단 기다리면서 올라온게 한 15분 인데  ​어어엄청 기다림의 시간을 보내고 난뒤 드디어 번호가 되어서 들어갔는데 들어가서 이렇게 우리의 눈을 현혹시키는 ㅋㅋㅋㅋ 영상들을 쏴준다 ㅋㅋㅋ 진짜 미니어처로 자동차가 지나가는거처럼 보이고 ㅋㅋㅋ 이다음부터 또 기다림의 시작 ㅋㅋㅋㅋ 아마 23대정도 엘리베이터 지나가곤했다 


 





 

 


 


​올라가서 본 야경은 예쁘다 다른나라에가서 타워 올라가봤는데 우리나라에서도 올라오면 또 이렇게 보이는구나 컴컴하니 아무것도 안보이는곳은 뭐지 ㅋㅋㅋ 남산 창작센터 우리나라도 높은 건물들도 많고 밤되니 바쁜 도시의 모습이 그대로 뭍어나와서 멋있다고 생각했다 그러면서도 옛날 스타일의 건물들도 많이 남겨두었으면 좋겠다는 생각도 함 


 




 

 





 

 


 


 


 





 



다소 쓸데없는 기념품 ㅋㅋㅋ기념주화 뽑기랑 이렇게 돈넣고 프레스 해서 기념주화만들기 가 있었다  시안갔을때도 진짜 쓸데없는데 ㅋㅋㅋㅋ했던거 생각나서 나란히 한개씩 하기로했다 2천원이었는데 그냥 생각보다 이쁘다고 ㅋㅋㅋ 엽서나 마그네틱도 기웃거려봤지만 그냥 내려놓았다 예쁜 굿즈 많이 개발해주세욤



 


​이렇게 서울여행 끝 집에돌아오니 12시훠우 ㅋㅋ 힘들다 ㅋㅋㅋㅋㅋ 


 ",,"['서울', '서울여행', '여행', '오늘', '마지막', '마지막코스', '코스', '남산', '남산타워', '타워', '거', '외국인', '외국인친구', '친구', '곳', '주말', '손님', '천국', '미안', '나도', '처음', '길', '컷', '7', '7년전', '년', '전', '밑', '버스', '애초', '롯데', '롯데타워쪽', '쪽', '계획', '앞', '구슬', '구슬모아당구장', '모아', '당구장', '전시', '때문', '동선', '포기', '아', '한남', '한남동', '동', '명동', '명동성당', '성당', '정류장', '김', '때', '본', '관광객', '가까이', '봄', '이날', '습', '구름', '소나기', '다행', '날', '남산서울타워', '서울특별', '서울특별시', '시', '용산', '용산구', '구', '용산동', '용산동2', '2', '산', '산111', '111', '남산케이블카', '케이블', '케이블카', '카', '중구', '회현', '회현동', '회현동1', '1', '산119', '119', '그전', '방문', '여', '버스타자', '타자', '급', '급더위', '더위', '15', '15정도', '정도', '완전', '언덕', '골목길', '나', '택시', '타고', '타고와야', '와야', '생각', '감', '편도', '왕복', '비용', '차이', '이용', '우리', '버스탈거', '탈거', '구매', '9500', '9500원', '원', '이구', '7500', '7500원', '기억', '등반', '등반끝', '끝', '표', '밤', '조명', '조명때문', '여기', '기', '기다림', '다림', '시작', '입구', '초점', '이탈', '뭐', '느낌', '도쿄', '도쿄타워', '데크', '아래', '여수', '홍', '홍콩', '콩', '4', '4인', '인', '한번', '20', '20명', '명', '장사', '한명', '5', '5천원', '천', '여', '여가기', '가기', '전주', '운행', '안', '줄', '선풍기', '건', '낮', '나무잎', '구경', '사실', '만큼', '탑승', '탑승시간', '시간', '길지', '운치', '다음', '기사', '기사님', '님', '베스트', '드라이버', '데크쪽', '유명', '자물쇠', '공간', '자판기', '신기', '신기방기', '방기', '외국인분', '분', '의외', '폰', '폰카', '날씨', '위', '사면', '30', '30분정도', '분', '대기', '진짜', '사람', '둘', '번', '수', '누군가', '말자', '아까', '계단', '15분', '뒤', '번호', '눈', '현혹', '영상', '미니어처', '자동차', '이다음', '23', '23대정도', '대', '엘리베이터', '야경', '나라', '우리', '우리나라', '컴', '컴컴', '아무것', '무엇', '창작', '창작센터', '센터', '건물', '도시', '모습', '뭍', '옛날', '스타일', '함', '기념품', '기념', '기념주화', '주화', '돈', '프레스', '기념주화만들기', '만들기', '시안', '개', '2천원', '엽서', '마그네틱', '굿', '굿즈', '즈', '개발', '주세욤', '집', '12', '12시훠우', '시', '훠', '우']",,
3,[여자 셋 서울 여행] 아시아 호텔 아트페어 2019 - 호텔에서 열리는 이색 전시 관람기,https://blog.naver.com/PostView.nhn?blogId=ddawndew&logNo=221617848934&from=search&redirect=Log&widgetTypeCall=true&directAccess=false,"





 

 


아 드디어 여름방학이 끝났습니다 ㅠㅠ 너무나도 짧게 끝나버린 여름방학이라 아쉬움이 큽니다만 지난 주말을 이용해 여자 셋이서 서울 여행이 이번 여름방학의 가장 큰 추억이지 않나 생각됩니다 8월 10일 여자 셋만 기차를 타고 서울여행을 갔습니다 작은 녀석이 그때 꼭 가야 할 행사가 있어서 참석하기 위해서 동행하기로 한 것이 여자들만의 여행이 되었다지요 마침 기간도 맞고해서 서울 코엑스 옆에 있는 인터컨티넨탈 호텔 파르나스에서 열리는 아시아 호텔 아트페어에 가보기로 하였답니다  미대생이 되기 위해 막바지 그림만 죽어라 그리는 고3 쇼콜라 공주와 요리를 하겠다더니 최근 들어서는 자기도 예고를 가서 미술을 하겠다고 선언한 바닐라 공주인지라 아트페어 행사가 아이들에게 큰 도움이 될 거 같아서 참석하게 되었습니다 ​​


 




 

 


서울 인터컨티넨탈 호텔 파르나스는 예전에 네이버 15주년 행사 때 왔던 기억이 있어서 그리 낯설지 않았습니다 지난 8월 8일부터 아트페어가 열렸었는데요 주말이라 선지 엘리베이터 입구부터 사람들이 꽤 많았습니다 1층 현장에서 바로 매표나 초대장 확인을 하고 올라가면 되더군요 전시는 호텔 객실 7층에서 10층까지 총 97개의 객실에서 전시가 열리게 됩니다 ​​


 




 

 


지방에서 열리는 아트페어는 가끔 챙겨서 가봤지만 호텔에서 열리는 아트페어는 처음인지라 과연 어떻게 열릴지 궁금하기도 하고 기대가 좀 되었습니다 하루도 빠짐없이 그림 그리기를 좋아하는 두 녀석들도 이 전시가 어떤 식으로 진행되는지는 모른 채 그저 엄마를 따라 쫄레쫄레 7층으로 향했습니다 ​​


 




 

 


말 그대로 객실에서 열리는 전시라 각 객실마다 다양한 작품을 만날 수 있었습니다 일반적인 아트페어와는 전혀 다른 성격이라 너무나 이색적이고 색달라서 너무 좋더라고요 ​​


 




 

 


객실의 침대와 가구 비품들도 그대로 둔 채 작품들만 곳곳에 전시된 형태라 아주 독특하면서도 마치 처음부터 그곳에 있었던 것처럼 자연스러움을 느끼게 하는 작품들도 많았습니다 각 갤러리마다 배정된 객실에서 작품들을 적절하게 비치해두다 보니 일률적이지 않고 개성 있으면서도 작품이 돋보이게 하는 센스 있는 구성도 보였습니다 ​​


 





 

 


 





 

 


 


무엇보다도 판매를 목적으로 하는 것이기 때문에 작품들마다 가격이 붙어져 있기도 했고 일반적인 아트페어의 흰 벽에 걸린 것보다는 실제 호텔 객실 벽에 걸려 있으니 작품을 내 집에 걸었을 때 어떤 느낌일지 상상이 더 쉽기 되기도 하며 잘 어울릴지에 대한 고민도 덜어주겠다 싶더군요 ​​


 




 

 


객실의 화장실에도 작품들이 설치되어 있답니다 공간을 적절하게 활용한 것도 보이고 객실이 거의 비슷하지만 객실 타입에 따라서 또 다른 느낌의 작품 전시를 만날 수 있어서 좋았습니다 ​​


 




 

 


창밖으로 보랏빛 맥문동 꽃이 활짝 핀 모습과 객실 내부의 꽃이 가득한 작품이 묘하게 잘 어울렸어요 객실마다 찾아다니면서 작품들을 감상하는데 아이들도 무척 흥미로워하더군요 사람은 또 어찌나 많은지 생각보다 너무 많아서 좀 놀라기도 했답니다 ​​


 





 

 


 


레진을 이용한 이 작품은 마치 살아있는 물고기가 헤엄치는 듯한 모습입니다 ​​


 




 

 


​


 





 

 


 


한국화 서양화 조소 공예 등 정말 다양한 작품들을 만날 수 있습니다 알고 있는 작가의 작품들도 참 많았지만 처음 알게 된 작가들도 많았답니다 이렇게 한곳에서 다양한 작품을 만날 수 있다는 자체가 미술품을 예술을 사랑하는 이들에게는 특별한 시간이지 않을까 싶더군요 ​​


 




 

 




 

 


미술작품만 있을 것이라 생각했는데 공예작품들도 있었습니다 세상에 하나밖에 없는 작품을 장신구로 착용할 수 있다는 것도 특별함을 부여하는 일이겠지요 모두 판매를 하는 것들이라 디자인을 보고 구매로 이어지는 경우가 많았습니다 ​​


 




 

 


여기는 도자기 작품들이 전시되어 있는 방이에요 호텔 방이라는 공간과 무척이나 잘 어울리는 느낌입니다 ​​


 




 

 


세밀하게 그려진 그림은 이미경 작가의 동전 하나로도 행복했던 구멍가게의 날들이 절로 떠올려졌습니다 봄밤의 아름다움이 오롯이 느껴지는 작품 앞에서 괜히 마음이 따스해졌어요 ​​


 





 

 


 




 

 


이렇듯 함께 작품들을 감상하더라도 느끼는 바는 다르고 자신의 취향이 각기 다르다 보니 좋아하는 작품도 다르더라고요 작품들을 보면서 각자 소감을 말하기도 하고 마음에 드는 작품들은 사진으로 찍기도 하는 등 열심히 감상을 했습니다 아이들 데리고 전시 관람을 하는 경우 처음엔 좀 관심을 가지다가 금세 흥미가 식어버리곤 하는데 이날은 신기하게도 아이들이 더 적극적으로 방방마다 찾아다니면서 열심히 작품을 감상하더군요 ​​


 




 

 


그림은 물론 사진 작품도 있었습니다 마침 책으로도 나왔다면서 책도 판매하고 있었어요 비엔나를 여행하면서 담은 순간들이 전시되어 있었지요 비엔나에서 담은 풍경과 함께 풀어놓을 이야기들이 살짝 궁금하기도 했습니다만 둘러볼 전시가 너무 많아서 일단 패스​​


 




 

 


이 방에는 들어서는 순간 향기에 반했습니다 입구부터 허브들이 놓인 데다가 객실 곳곳에 싱그러운 허브들과 천연 디퓨저들의 향이 은은하게 퍼지고 있었습니다 전시를 보러 가서 이런 광경을 만날 것이라고는 예상치 못했답니다 ​​


 




 

 


향이 어찌나 매혹적인지 결국 제가 쓸 것과 선물용 2개를 구입했답니다 양에 비하면 다소 비싼 가격이지만 여기 아니면 이 향을 구입할 수 없기에 후회할 바에는 지르자 싶어 과감히 질렀습니다 디퓨저 용기들은 모두 도예 작가의 작품들로 아로마용품과 콜라보를 한 작품들이랍니다 ​​


 




 

 


이곳에 오기 전에는 1시간  1시간 반 정도면 다 둘러보겠지라고 생각했는데 97개의 객실에 전시된 작품들이 너무 많고 인상적이라 생각보다 관람하는데 꽤 시간이 걸렸습니다 그렇다 보니 아이들은 나중에 체력이 고갈되어 너무 힘들다고 하더군요 ㅎㅎ VIP라운지가 층마다 있던데 거기서 쉬어가면서 관람을 하면 그리 힘들지 않을 텐데 VIP가 아닌지라 입구에서 구경만 하는 신세였다지요 그리고 도록이 너무 갖고 싶었는데 입구에서 도록을 나눠주길래 물어봤더니 VIP만 준다고 ㅡㅡ 그러니까 저는 돈 주고 사야 한다는 거예요 돌아다니다 보니 어째 우리 말고는 다 VIP 같다는 생각이 ㅠㅠ​​


 




 

 


전시를 보다 보면 기발한 작품들 신기한 작품들 멋짐이 느껴지는 작품들 다양한 느낌의 작품을 만나게 됩니다 침대 위가 마치 바다가 된 듯 수영을 즐기는 도자기 인형들의 모습이 너무 재밌었어요 ​​


 




 

 


욕실로 갔더니 욕조 안에도 작품이 있는데 더 실감 나게 느껴지는 거 있죠 ㅎㅎ ​​


 




 

 


또 다른 곳에는 이렇게 물고기가 그려진 접시를 물속에 담아두어 느낌을 살렸더라고요 ​​


 





 

 


 





 

 


 


제가 미술 전시를 좋아하는 이유는 잘 몰라도 다양한 작가들의 상상력 넘치는 작품들을 보면서 영감을 얻는다는 거지요 뭔가 새롭고 신선한 충격이 흥미롭게 만들고 상상력을 자극하게 됩니다 아이들에게도 이런 전시를 보게 한 이유도 많은 것을 보고 느끼고 배울 수 있는 기회를 마련해주고 싶어서였답니다 ​​


 




 

 


입구에 있는 동상을 보면서 김정은 닮았네  했더니 객실 내부에는 문재인 대통령이 있고 또 다른 곳에는 트럼프 대통령도 있더라고요 얼핏 보았던 입구의 그 동상은 김정은이 맞았습니다 ​​


 




 

 


이렇듯 작품들 속에서 세계의 유명 인사들도 만나게 되는군요 ​​


 




 

 


조금씩 지쳐가는 속에서 여행 온 기념으로 기념촬영 하자며 잠시 멈추어 서서 사진으로 남겨 보았습니다 아이들도 무척 좋아했던 전시라 대만족이었네요 ​​


 




 

 




 

 


아이들 좋아하는 피규어와 귀여운 캐릭터들 제가 좋아하는 그로밋이 빨간 점박이가 되어 서 있는 것도 만났습니다 작품들을 감상하면서 든 생각은 너무 그림이 그리고 싶은 거예요 다양한 재료를 이용해 각기 자신만의 색깔로 담아낸 작품들을 감상하다 보니 제 안의 꿈틀거리는 무언가가 미친 듯 그림을 그리고 싶게 만들더라고요 잘 그리고 못 그리고를 떠나서 뭔가를 표현한다는 것 그것만으로도 흥분되고 재미난 일이지 않나 싶어요 작가들의 에너지를 한껏 받아서 그런 거 같기도 하고요 아시아 호텔 아트페어는 제게도 아이들에게도 신선한 자극이 된 멋진 경험이자 전시였답니다 다음 기회가 되면 또 이런 전시를 만나고 싶네요 ​​


 







그랜드 인터컨티넨탈 서울 파르나스
서울특별시 강남구 테헤란로 521

 


 


​


 ",,"['여름', '여름방학', '방학', '아쉬움', '주말', '이용', '여자', '셋', '서울', '여행', '이번', '추억', '생각', '8', '8월', '월', '10', '10일', '일', '기차', '서울여행', '녀석', '그때', '행사', '참석', '동행', '만', '기간', '코', '코엑스', '엑스', '옆', '인터', '티', '티넨', '넨', '호텔', '파', '파르나스', '르', '나스', '아시아', '아트', '아트페어', '페어', '미', '미대생', '대생', '막바지', '그림', '고', '고3', '3', '쇼', '쇼콜라', '콜라', '공주', '요리', '최근', '자기도', '예고', '미술', '선언', '바닐라', '라', '아이', '도움', '거', '예전', '네이버', '15', '15주년', '주년', '때', '기억', '8일', '선지', '엘리베이터', '입구', '사람', '1', '1층', '층', '현장', '매표', '초대장', '확인', '전시', '객실', '7', '7층', '10층', '97', '97개', '개', '지방', '처음', '기대', '하루', '그리기', '녀석', '식', '진행', '채', '엄마', '레', '말', '전시라', '다양', '작품', '수', '일반적', '성격', '이색적', '고요', '침대', '가구', '비품', '만', '곳곳', '형태', '독특', '그곳', '자연', '각', '갤러리', '배정', '비치', '일률적', '개성', '센스', '구성', '무엇', '판매', '목적', '때문', '가격', '벽', '실제', '내', '집', '느낌', '상상', '지에', '대', '고민', '화장실', '설치', '공간', '활용', '타입', '창', '창밖', '밖', '보랏빛', '맥문동', '꽃', '모습', '내부', '감상', '흥미', '워', '레진', '물고기', '한국화', '서양화', '조소', '공예', '등', '작가', '한곳', '자체', '미술품', '예술', '사랑', '이', '특별', '시간', '미술작품', '공예작품', '세상', '하나', '장신구', '착용', '부여', '일', '모두', '디자인', '구매', '경우', '여기', '도자기', '방', '경', '동전', '행복', '구멍가게', '날', '봄밤', '아름다움', '앞', '마음', '바', '자신', '취향', '각자', '소감', '말하기', '사진', '관람', '관심', '이날', '적극적', '방방', '책', '비', '순간', '비엔나', '풍경', '이야기', '패스', '향기', '허브', '데', '천연', '디퓨저', '향', '광경', '예상', '향이', '매혹적', '결국', '제가', '선물', '2', '2개', '구입', '양', '후회', '용기', '도예', '로', '아로마', '아로마용품', '용품', '이곳', '전', '1시간', '시간', '반', '정도', '인상적', '나중', '체력', '고갈', '라운', '라운지가', '지가', '거기', '터', '구경', '신세', '도록', '저', '돈', '주고', '우리', '기한', '멋', '멋짐', '짐', '위', '바다', '듯', '수영', '인형', '욕실', '욕조', '안', '실감', '곳', '접시', '물속', '이유', '상상력', '영감', '거지', '충격', '자극', '기회', '마련', '동상', '김', '문', '문재인', '재인', '대통령', '트럼프', '김정은', '정은', '속', '세계', '유명', '인사', '조금', '온', '기념', '기념촬영', '촬영', '하자', '서서', '대만족', '피규어', '캐릭터', '그로밋', '점박이', '재료', '색깔', '제', '무언가', '표현', '그것', '흥분', '에너지', '게', '경험', '경험이자', '이자', '다음', '그랜드', '서울특별', '서울특별시', '시', '강남', '강남구', '구', '테헤란', '521']",,
